{
  "overview": "A minimal, single-page personal website built as a pure static site (JAMstack). React + Vite + Tailwind CSS frontend with no backend or database. All content is driven by JSON configuration files in /src/data/, editable by non-developers. The site consists of five anchor-linked sections (Hero, About, Portfolio, Contact, Footer) with a fixed navigation bar, dark/light mode toggle, and responsive design from 320px to 2560px. The contact form delegates to Formspree (free third-party service). Built and deployed to Vercel's free tier with automatic CI/CD from a public GitHub repository. No SSR, no API server, no database — fully static HTML/JS/CSS output.",
  "components": [
    {
      "name": "App",
      "description": "Root React component. Wraps the entire application with ThemeProvider and SEOHead. Renders Navbar and all page sections in a single-column layout. Owns scroll-spy state for active navigation highlighting.",
      "responsibilities": [
        "Render page shell: Navbar, main content sections, Footer, ScrollToTop",
        "Provide ThemeProvider context to all children",
        "Manage active section state via IntersectionObserver for nav highlighting",
        "Set up smooth-scroll behavior for anchor navigation"
      ],
      "dependencies": ["ThemeProvider", "SEOHead", "Navbar", "HeroSection", "AboutSection", "PortfolioSection", "ContactSection", "Footer", "ScrollToTop"]
    },
    {
      "name": "ThemeProvider",
      "description": "React context provider for dark/light theme management. Detects system preference on initial load via prefers-color-scheme media query. Persists user override in localStorage. Toggles a 'dark' class on <html> for Tailwind's class-based dark mode.",
      "responsibilities": [
        "Detect system color-scheme preference on first visit",
        "Read stored theme preference from localStorage (override system default)",
        "Expose theme ('light' | 'dark') and toggleTheme() via context",
        "Add/remove 'dark' class on document.documentElement for Tailwind dark mode",
        "Persist user choice to localStorage on toggle"
      ],
      "dependencies": []
    },
    {
      "name": "SEOHead",
      "description": "Manages document <head> content using react-helmet-async. Sets page title, meta description, Open Graph tags, and canonical URL from site config. Each section could optionally update these via props if multi-page-like behavior is desired, but for v1 a single static head configuration suffices.",
      "responsibilities": [
        "Set <title> from siteConfig",
        "Set meta description, keywords",
        "Set Open Graph tags (og:title, og:description, og:image, og:url, og:type)",
        "Set Twitter Card tags for social sharing",
        "Set canonical URL",
        "Include JSON-LD structured data (Person schema) for SEO"
      ],
      "dependencies": []
    },
    {
      "name": "Navbar",
      "description": "Fixed/sticky top navigation bar. On desktop (≥768px), displays horizontal nav links. On mobile (<768px), collapses into a hamburger menu with a slide-down panel. Highlights the currently visible section based on scroll position. All links trigger smooth-scroll to anchor targets.",
      "responsibilities": [
        "Render site logo/name on the left",
        "Render nav links: Hero, About, Portfolio, Contact (from config)",
        "Highlight active link based on current section in viewport",
        "On mobile: render hamburger icon, toggle dropdown panel on click",
        "Close mobile menu on link click or outside click",
        "Include theme toggle button (sun/moon icon)",
        "Sticky positioning with backdrop blur on scroll",
        "Skip-to-content link for keyboard accessibility"
      ],
      "dependencies": []
    },
    {
      "name": "HeroSection",
      "description": "Full-viewport-height hero area. Displays the site owner's avatar, name, a short tagline/intro, and call-to-action buttons that scroll to other sections (About, Portfolio, Contact). Visual focus is on personal brand and first impression.",
      "responsibilities": [
        "Render owner avatar image (from /public/images/, lazy loaded)",
        "Display name (h1) and tagline (p) from profile config",
        "Render 1-3 CTA buttons linking to other sections via anchor",
        "Ensure content fits on screen without scrolling on all viewport sizes",
        "Support animated entrance (optional subtle fade-in on load)",
        "Semantic HTML: use <header> landmark"
      ],
      "dependencies": []
    },
    {
      "name": "AboutSection",
      "description": "Multi-part about section containing: (1) a bio paragraph introducing the owner, (2) skill badges displayed as a flex-wrap tag cloud, and (3) a vertical timeline of work/education experience. All content driven by config files.",
      "responsibilities": [
        "Render section heading with id='about' for anchor navigation",
        "Render bio paragraph from profile config",
        "Render skill badges as styled tags (via SkillBadge component)",
        "Render experience timeline (via Timeline component)",
        "Support optional profile image alongside bio",
        "Semantic HTML: use <section> with aria-label"
      ],
      "dependencies": ["SkillBadge", "Timeline"]
    },
    {
      "name": "SkillBadge",
      "description": "A small styled badge/pill displaying a single skill name. Optionally color-coded by category (e.g., Frontend, Backend, Design, Tools). Pure presentational component.",
      "responsibilities": [
        "Render skill name as a pill/tag with Tailwind styling",
        "Apply category-based color if provided (via Tailwind color classes)",
        "Ensure text is readable at small sizes (≥14px)"
      ],
      "dependencies": []
    },
    {
      "name": "Timeline",
      "description": "A vertical timeline layout component. Renders an ordered list of TimelineItem entries with a connecting vertical line and dot/bullet markers. Responsive: left-aligned on mobile, alternating left/right on desktop (optional, can also be single-column for simplicity).",
      "responsibilities": [
        "Receive array of timeline entries as prop",
        "Render vertical line with dot markers",
        "Layout items in chronological order (newest first or last, configurable)",
        "Responsive layout: single column mobile, two-column alternating on desktop"
      ],
      "dependencies": ["TimelineItem"]
    },
    {
      "name": "TimelineItem",
      "description": "A single entry in the experience timeline. Displays title/role, organization, date range (start–end or start–present), and a brief description. Supports optional organization logo or icon.",
      "responsibilities": [
        "Render title (role/degree), organization name, date range",
        "Render description text if provided",
        "Show 'Present' label if no end date",
        "Apply visual dot/bullet connector to the timeline line"
      ],
      "dependencies": []
    },
    {
      "name": "PortfolioSection",
      "description": "Project/work showcase section. Renders a responsive CSS Grid of ProjectCard components. On desktop (≥1024px), 3 columns. On tablet (≥640px), 2 columns. On mobile, 1 column. Includes a section heading and optional filter by project tag/category (v2 consideration).",
      "responsibilities": [
        "Render section heading with id='portfolio' for anchor navigation",
        "Render responsive grid of ProjectCard components",
        "Handle empty state if no projects are configured",
        "Semantic HTML: use <section> with aria-label"
      ],
      "dependencies": ["ProjectCard"]
    },
    {
      "name": "ProjectCard",
      "description": "An individual project card displaying a thumbnail image (or placeholder), project title, short description (≤200 chars), technology tags, and external links (live demo URL, GitHub repo URL). Cards have hover elevation effect for visual polish.",
      "responsibilities": [
        "Render thumbnail image with lazy loading and alt text",
        "Show placeholder gradient or icon if no thumbnail provided",
        "Display project title (h3) and description (p, truncated)",
        "Render technology tags as small badges",
        "Render external link buttons (Live Demo, GitHub) — open in new tab",
        "Apply hover shadow/scale transition",
        "Ensure keyboard focusability for links",
        "Semantic HTML: use <article>"
      ],
      "dependencies": []
    },
    {
      "name": "ContactSection",
      "description": "Contact section with two sub-components: (1) direct contact info (email link, social media icon links), and (2) an optional contact form that POSTs to Formspree. If no Formspree endpoint is configured, only show direct contact info.",
      "responsibilities": [
        "Render section heading with id='contact' for anchor navigation",
        "Display email with mailto: link",
        "Display social media links as icon buttons (from Lucide React)",
        "Render ContactForm if formspreeEndpoint is configured",
        "Semantic HTML: use <section> with aria-label"
      ],
      "dependencies": ["ContactForm"]
    },
    {
      "name": "ContactForm",
      "description": "A simple contact form with name, email, subject, and message fields. Submits to Formspree (or configurable Web3Forms endpoint). Handles loading, success, and error states. Includes a honeypot field for basic bot protection. Client-side validation for required fields and email format.",
      "responsibilities": [
        "Render controlled inputs: name (required), email (required, validated), subject, message (required)",
        "Client-side validation: required fields, email regex",
        "Include honeypot hidden field for bot protection",
        "POST form data as JSON to configured Formspree endpoint",
        "Show loading state on submit button during request",